{
  "schema_version": "1.0.0",
  "request_id": "77777777-7777-4777-8777-777777777777",
  "project_id": "11111111-1111-4111-8111-111111111111",
  "locale": "ru-RU",
  "image_refs": ["img_front_12345678"],
  "supported_garment_categories": ["dress", "sundress"],
  "supported_features": {
    "neckline": ["round", "v", "square"],
    "sleeve": ["sleeveless", "short", "long"],
    "skirt": ["straight", "a_line"]
  },
  "image_transmission_confirmed": true
}
